{
  "$schema": "../../schemas/sld-ir.schema.json",
  "drawing_type": "single_line_diagram",
  "version": "1.3.0",
  "meta": {
    "project_id": "intl-commercial-msb-4subdbs-eg03",
    "skill_version": "sld/1.5.0",
    "produced_at": "2026-05-19T11:00:00Z",
    "consumed_intents": [
      {
        "intent_type": "db-layout",
        "intent_version": "1.0.0",
        "produced_by": "electrical/db-layout/v1.2.0",
        "path": "electrical/db-layout/examples/intl-commercial-tpn-msb/intent-out.json"
      },
      {
        "intent_type": "db-layout",
        "intent_version": "1.0.0",
        "produced_by": "electrical/db-layout/v1.2.0",
        "path": "electrical/db-layout/examples/intl-dbl1-lighting/intent-out.json"
      },
      {
        "intent_type": "db-layout",
        "intent_version": "1.0.0",
        "produced_by": "electrical/db-layout/v1.2.0",
        "path": "electrical/db-layout/examples/intl-dbp1-power/intent-out.json"
      },
      {
        "intent_type": "db-layout",
        "intent_version": "1.0.0",
        "produced_by": "electrical/db-layout/v1.2.0",
        "path": "electrical/db-layout/examples/intl-dbm1-mechanical/intent-out.json"
      },
      {
        "intent_type": "db-layout",
        "intent_version": "1.0.0",
        "produced_by": "electrical/db-layout/v1.2.0",
        "path": "electrical/db-layout/examples/intl-dbfa1-fire-alarm/intent-out.json"
      },
      {
        "intent_type": "db-layout",
        "intent_version": "1.0.0",
        "produced_by": "electrical/db-layout/v1.3.0",
        "path": "electrical/db-layout/examples/intl-dbem-emergency-lighting/intent-out.json"
      },
      {
        "intent_type": "db-layout",
        "intent_version": "1.0.0",
        "produced_by": "electrical/db-layout/v1.3.0",
        "path": "electrical/db-layout/examples/intl-dbcomms-data/intent-out.json"
      },
      {
        "intent_type": "db-layout",
        "intent_version": "1.0.0",
        "produced_by": "electrical/db-layout/v1.3.0",
        "path": "electrical/db-layout/examples/intl-dbups-backed/intent-out.json"
      },
      {
        "intent_type": "db-layout",
        "intent_version": "1.0.0",
        "produced_by": "electrical/db-layout/v1.3.0",
        "path": "electrical/db-layout/examples/intl-dbgenset-changeover/intent-out.json"
      },
      {
        "intent_type": "earthing",
        "intent_version": "1.0.0",
        "produced_by": "electrical/earthing/v1.4.0",
        "path": "electrical/earthing/examples/intl-rural-tncs/intent-out.json"
      },
      {
        "intent_type": "fault-level",
        "intent_version": "1.0.0",
        "produced_by": "electrical/fault-level/v1.1.0",
        "path": "electrical/fault-level/examples/intl-commercial-with-genset/intent-out.json"
      }
    ]
  },
  "jurisdiction": "INT",
  "supply_origin": {
    "supplier": "Utility (generic IEC jurisdiction)",
    "wayleave_or_account_reference": "INT-COMM-2026-EG03",
    "system_type": "TN-C-S",
    "voltage_nominal_v": 400,
    "voltage_arrangement": "TPN_plus_E",
    "frequency_hz": 50,
    "ze_declared_ohm": 0.3,
    "pfc_declared_ka": 16.0,
    "main_switch_rating_a": 800,
    "main_switch_breaking_capacity_ka": 50
  },
  "distribution_hierarchy": [
    {
      "board_id": "MSB-MAIN",
      "board_role": "main_switchboard",
      "consumed_intent_path": "electrical/db-layout/examples/intl-commercial-tpn-msb/intent-out.json",
      "parent_board_id": null,
      "fed_via_circuit_id": null,
      "location": "ground-floor plant room",
      "enclosure_rating": "IP4X"
    },
    {
      "board_id": "DB-L1",
      "board_role": "sub_distribution_board",
      "consumed_intent_path": "electrical/db-layout/examples/intl-dbl1-lighting/intent-out.json",
      "parent_board_id": "MSB-MAIN",
      "fed_via_circuit_id": "F01",
      "location": "ground-floor lighting riser",
      "enclosure_rating": "IP4X"
    },
    {
      "board_id": "DB-P1",
      "board_role": "sub_distribution_board",
      "consumed_intent_path": "electrical/db-layout/examples/intl-dbp1-power/intent-out.json",
      "parent_board_id": "MSB-MAIN",
      "fed_via_circuit_id": "F02",
      "location": "ground-floor power riser",
      "enclosure_rating": "IP4X"
    },
    {
      "board_id": "DB-M1",
      "board_role": "sub_distribution_board",
      "consumed_intent_path": "electrical/db-layout/examples/intl-dbm1-mechanical/intent-out.json",
      "parent_board_id": "MSB-MAIN",
      "fed_via_circuit_id": "F03",
      "location": "ground-floor mechanical riser",
      "enclosure_rating": "IP4X"
    },
    {
      "board_id": "DB-FA1",
      "board_role": "fire_alarm_panel",
      "consumed_intent_path": "electrical/db-layout/examples/intl-dbfa1-fire-alarm/intent-out.json",
      "parent_board_id": "MSB-MAIN",
      "fed_via_circuit_id": "F04",
      "location": "ground-floor fire-alarm room",
      "enclosure_rating": "IP4X"
    },
    {
      "board_id": "DB-EM",
      "board_role": "life_safety_panel",
      "consumed_intent_path": "electrical/db-layout/examples/intl-dbem-emergency-lighting/intent-out.json",
      "parent_board_id": "MSB-MAIN",
      "fed_via_circuit_id": "F05",
      "location": "ground-floor EM equipment room",
      "enclosure_rating": "IP4X"
    },
    {
      "board_id": "DB-COMMS",
      "board_role": "sub_distribution_board",
      "consumed_intent_path": "electrical/db-layout/examples/intl-dbcomms-data/intent-out.json",
      "parent_board_id": "MSB-MAIN",
      "fed_via_circuit_id": "F06",
      "location": "ground-floor main comms room (MDF)",
      "enclosure_rating": "IP4X"
    },
    {
      "board_id": "DB-UPS",
      "board_role": "ups_distribution",
      "consumed_intent_path": "electrical/db-layout/examples/intl-dbups-backed/intent-out.json",
      "parent_board_id": "MSB-MAIN",
      "fed_via_circuit_id": "F07",
      "location": "ground-floor server/UPS room",
      "enclosure_rating": "IP4X"
    },
    {
      "board_id": "DB-GENSET-XCV",
      "board_role": "sub_distribution_board",
      "consumed_intent_path": "electrical/db-layout/examples/intl-dbgenset-changeover/intent-out.json",
      "parent_board_id": "MSB-MAIN",
      "fed_via_circuit_id": "F08",
      "location": "external genset enclosure + ATS in ground-floor plant room",
      "enclosure_rating": "IP54"
    }
  ],
  "selectivity_cascade": [
    {
      "parent_board_id": "MSB-MAIN",
      "parent_circuit_id": "F01",
      "child_board_id": "DB-L1",
      "verdict": "selective",
      "verification_method": "iec_60898_typical",
      "_note": "F01 800A Type D upstream / 250A downstream main = 3.2:1 ratio, above IEC 60898 typical 3:1 selectivity threshold."
    },
    {
      "parent_board_id": "MSB-MAIN",
      "parent_circuit_id": "F02",
      "child_board_id": "DB-P1",
      "verdict": "partial_selective",
      "verification_method": "iec_60898_typical",
      "_note": "F02 800A Type D upstream / 400A downstream main = 2.0:1 ratio, BELOW the IEC 60898 typical 3:1 selectivity threshold. Manufacturer selectivity-table consultation required for design intent; in practice the short-time grading on modern MCCBs typically maintains discrimination at this ratio, but cannot be claimed without the device-pair-specific table."
    },
    {
      "parent_board_id": "MSB-MAIN",
      "parent_circuit_id": "F03",
      "child_board_id": "DB-M1",
      "verdict": "selective",
      "verification_method": "iec_60898_typical",
      "_note": "F03 800A Type D upstream / 250A downstream main = 3.2:1 ratio, above IEC 60898 typical threshold. Mechanical inrush (motor starts on M01/M03) handled by D-curve coordination."
    },
    {
      "parent_board_id": "MSB-MAIN",
      "parent_circuit_id": "F04",
      "child_board_id": "DB-FA1",
      "verdict": "selective",
      "verification_method": "iec_60898_typical",
      "_note": "F04 800A Type D upstream / 63A Type C downstream main = 12.7:1 ratio, deeply selective. CRITICAL: F04 fire_alarm feeder has NO upstream RCD per IEC 60364-5-56 §560 — life-safety isolation maintained at MSB level; RCDs at MSB intake would trip the entire DB-FA1 panel on a single earth-fault and disable fire-alarm functionality."
    },
    {
      "parent_board_id": "MSB-MAIN",
      "parent_circuit_id": "F05",
      "child_board_id": "DB-EM",
      "verdict": "selective",
      "verification_method": "iec_60898_typical",
      "_note": "F05 800A Type D upstream / 40A Type C downstream main = 20.0:1 ratio, deeply selective. F05 emergency-lighting feeder has NO upstream RCD per IEC 60364-5-56:2018 §560.7 — central-battery / sustained-supply EM lighting requires same life-safety isolation pattern as fire-alarm. Earth-fault clearance via TN-C-S adiabatic 5s per IEC 60364-4-41 §411.3.2.2."
    },
    {
      "parent_board_id": "MSB-MAIN",
      "parent_circuit_id": "F06",
      "child_board_id": "DB-COMMS",
      "verdict": "selective",
      "verification_method": "iec_60898_typical",
      "_note": "F06 800A Type D upstream / 32A Type C downstream main = 25.0:1 ratio, deeply selective. F06 comms feeder carries a Type B RCD upstream of DB-COMMS per IEC 60364-5-53:2002+A2:2015 §531.3.3 (DC-leakage-tolerant for IT/SMPS loads — BS EN 50173:2018 EMC). Type B selectivity vs final-circuit Type A RCDs on data circuits is achieved by time-delay (S-type or selective Type B) at the feeder tier."
    },
    {
      "parent_board_id": "MSB-MAIN",
      "parent_circuit_id": "F07",
      "child_board_id": "DB-UPS",
      "verdict": "selective",
      "verification_method": "iec_60898_typical",
      "_note": "F07 800A Type D upstream / 50A Type C downstream main = 16.0:1 ratio, deeply selective. F07 feeds the UPS input (10 kVA online double-conversion); the UPS-output side of DB-UPS is electrically downstream of the UPS rectifier+inverter pair and therefore decoupled from the upstream MSB during normal operation. Bypass-mode selectivity (when UPS is in static-bypass) reverts to the F07 cascade ratio."
    },
    {